{"summary":"Use a board-owned server orchestration layer between the RSC page and the independent work-items/labels capabilities. The board imports only their trusted public server APIs; those capabilities never import each other.","tree":[{"path":"app/board/page.tsx","purpose":"RSC entry point; reads route/search params and calls the board server query."},{"path":"features/board/server/get-board.ts","purpose":"Board orchestration and policy: authenticate actor, load work-items and labels, hide archived items, group by status, attach visible label details, and reject inaccessible labels."},{"path":"features/board/server/board-types.ts","purpose":"Board-specific view-model and result/error types."},{"path":"features/work-items/server/api/list-work-items.ts","purpose":"Trusted work-items API; owns work-item persistence and work-item authorization."},{"path":"features/work-items/server/work-item-types.ts","purpose":"Public work-item DTOs and status types."},{"path":"features/labels/server/api/get-visible-labels.ts","purpose":"Trusted labels API; returns only labels viewable by the actor and owns label persistence/authorization."},{"path":"features/labels/server/label-types.ts","purpose":"Public label DTOs."},{"path":"features/board/server/get-board.test.ts","purpose":"Unit tests for orchestration, policy, authorization, and failure behavior."},{"path":"app/board/page.test.tsx","purpose":"RSC/page-level rendering and result-state tests."}],"flows":["Request: `app/board/page.tsx` calls `features/board/server/get-board.ts` with the authenticated actor and board filters.","`get-board.ts` obtains the actor from the shared trusted auth boundary, then calls `listWorkItems({ actor, ...filters })` and `getVisibleLabels({ actor, labelIds })` through their public server APIs.","The orchestrator removes archived work-items, groups remaining items by status, collects referenced label IDs, and attaches only label DTOs returned by `getVisibleLabels`.","If a referenced label is not returned because the actor cannot view it, the orchestrator returns a typed policy error or omits the label according to the board contract; it must never query label storage directly.","The orchestrator returns a serializable board view-model. The RSC page renders status groups and label details, or a stable error/empty state."],"decisions":[{"topic":"Orchestration ownership","choice":"Board feature owns `get-board.ts`","rationale":"Hide-archived, grouping, label attachment, and cross-capability rejection are board policy, not work-item or label persistence concerns."},{"topic":"Dependency direction","choice":"`app/board` → `features/board` → public APIs of `features/work-items` and `features/labels`","rationale":"Capabilities remain independently changeable and do not import one another."},{"topic":"Public surfaces","choice":"Expose narrow trusted server functions and DTOs from each capability","rationale":"Prevents the board from depending on repositories, tables, or internal authorization details."},{"topic":"Authentication and authorization","choice":"Resolve the actor once at the server boundary; pass it explicitly to both capability APIs","rationale":"Avoids client-controlled identity and ensures each capability enforces its own visibility rules."},{"topic":"Failure behavior","choice":"Return typed failures from the orchestrator and render them in the RSC page","rationale":"Distinguishes unauthenticated, forbidden, dependency failure, and malformed/inaccessible-label cases without leaking storage details."},{"topic":"Testing","choice":"Mock public capability APIs in board unit tests; separately test each capability’s authorization and persistence","rationale":"Verifies board policy while preserving independent capability ownership."}],"risks":["If labels are fetched in a separate call, the board must define whether missing/inaccessible label IDs cause a whole-board rejection or per-label omission; this should be explicit in the typed contract.","Cross-capability calls may produce inconsistent snapshots; use stable request-scoped reads or document eventual consistency if the APIs cannot provide a shared snapshot.","Do not expose raw dependency errors or unauthorized label existence through the RSC response."]}