{"summary":"Use one transport-neutral generation use-case and policy, exposed through a dedicated SSE Route Handler for browsers and a durable job adapter for background execution. Do not reuse a Server Action: it cannot own the long-lived HTTP stream, request abort signal, committed-header behavior, or SSE status semantics.","tree":[{"path":"app/api/assistant/stream/route.ts","purpose":"Thin HTTP inbound adapter: authenticate, validate, compose dependencies, and return the SSE Response."},{"path":"app/(assistant)/assistant/page.tsx","purpose":"RSC entrypoint for the assistant UI."},{"path":"ui/assistant/AssistantStream.tsx","purpose":"Client component that starts the stream, consumes SSE events, and aborts on cancellation/unmount."},{"path":"domain/assistant/generation.ts","purpose":"Prompt/input schemas, safe public failure categories, generation event types, and pure policy values."},{"path":"use-cases/assistant/generate-assistant.ts","purpose":"Application boundary coordinating authorization context, generation policy, provider port, cancellation, idle-timeout decisions, and normalized outcomes."},{"path":"use-cases/assistant/ports/assistant-model.ts","purpose":"Provider seam accepting prompt/context plus AbortSignal and yielding normalized provider events."},{"path":"use-cases/assistant/ports/generation-job.ts","purpose":"Optional durable-job port for enqueueing and recording retry/dead-letter state."},{"path":"adapters/outbound/assistant/remote-model.ts","purpose":"Remote provider implementation: request construction, provider SSE decoding, provider error normalization, and abort propagation."},{"path":"adapters/inbound/next/assistant-stream.ts","purpose":"Reusable Next-specific stream orchestration: SSE encoding, idle watchdog, abort wiring, safe error mapping, and single unexpected-error capture."},{"path":"adapters/inbound/jobs/assistant-generation.ts","purpose":"Job handler invoking the same use-case and translating normalized failures into retry or dead-letter decisions."},{"path":"infrastructure/assistant/composition.ts","purpose":"Server-only dependency composition: provider client, policy configuration, auth, logger, telemetry, and job services."},{"path":"infrastructure/observability/server.ts","purpose":"Redacted logging and exception capture owned by inbound adapters/infrastructure."}],"flows":["Browser request: `AssistantStream.tsx` sends `POST /api/assistant/stream` with an `AbortController` signal → `app/api/assistant/stream/route.ts` authenticates and validates → `adapters/inbound/next/assistant-stream.ts` invokes `use-cases/assistant/generate-assistant.ts` → the use-case calls `AssistantModel.generate(input, request.signal)` → `adapters/outbound/assistant/remote-model.ts` calls the provider and decodes provider events → normalized tokens become SSE `token` events, followed by `done`.","Cancellation: browser aborts the fetch → the Route Handler’s request signal reaches the use-case and provider adapter → the provider request is aborted and the stream closes without retrying or reporting cancellation as an unexpected failure.","Idle timeout: the inbound stream adapter resets a watchdog whenever a provider event is received. If no event arrives during the configured idle interval, it aborts the provider request and emits a normalized timeout failure. This watchdog is per idle gap; it does not impose a maximum duration on an otherwise active successful stream.","Failure before headers: validation, auth, provider, timeout, or application failures are mapped to safe HTTP status plus a generic JSON/SSE-compatible error body; raw provider messages, keys, stacks, and internal hints remain server-side.","Failure after headers: once SSE headers are committed, the adapter emits one in-band `error` event with a safe public code, then closes the stream. A final `done` event is not emitted after failure.","Unexpected failure reporting: the inbound adapter has the single capture owner. It records one redacted exception with request/route metadata, maps it to a generic internal failure, and avoids duplicate capture by outer request hooks.","Background job: queue worker at `adapters/inbound/jobs/assistant-generation.ts` loads the job payload → invokes the same generation use-case and provider port with a job-scoped cancellation/timeout signal → transient normalized failures return retry with bounded backoff → permanent, exhausted, invalid, or policy failures are recorded as dead-letter → success persists/ publishes the completed result through the job’s outbound port."],"decisions":[{"topic":"Application boundary","choice":"`use-cases/assistant/generate-assistant.ts` is the shared boundary","rationale":"It owns generation orchestration and transport-neutral policy while remaining independent of Next.js, SSE, provider SDKs, queues, and telemetry."},{"topic":"Browser transport","choice":"Dedicated `POST` Route Handler with SSE","rationale":"Route Handlers own HTTP headers, status codes, streaming, request cancellation, and committed-response behavior; these are required lifecycle properties."},{"topic":"Server Action proposal","choice":"Do not use a Server Action for the stream","rationale":"A Server Action is suitable for UI commands but is not the correct browser-owned streaming transport and ordinary request retry cannot safely resume a token stream or preserve cancellation semantics."},{"topic":"Shared result abstraction","choice":"Share normalized application outcomes and failure taxonomy, not one concrete HTTP/stream/job wrapper","rationale":"HTTP responses, SSE event sequences, and job retry/dead-letter decisions have different lifecycles. Forcing one wrapper would obscure committed headers and partial-stream failure handling."},{"topic":"Provider seam","choice":"Port in `use-cases/assistant/ports/assistant-model.ts`","rationale":"The use-case depends on normalized events and `AbortSignal`; only the outbound adapter knows provider protocol, SDK errors, and wire-level cancellation."},{"topic":"Timeout ownership","choice":"Inbound stream adapter for SSE idle timing; use-case/job policy for transport-neutral deadlines","rationale":"The SSE adapter must observe event arrival, while jobs need their own execution deadline and retry semantics. Neither should impose a whole-stream duration on active output."},{"topic":"Error capture","choice":"One capture owner in the inbound adapter/infrastructure boundary","rationale":"Caught unexpected failures are reported exactly once before safe conversion; expected failures are normalized without telemetry noise."}],"risks":["Provider buffering or intermediary proxy buffering can delay visible SSE events and make idle detection appear inaccurate; configure streaming-compatible response headers and verify deployment behavior.","A retrying job must use an idempotency key or job-generation identifier to prevent duplicate persistence or publication.","The provider adapter must distinguish caller cancellation from timeout and provider failure so cancellation is not retried or reported.","Authentication and authorization must be rechecked in the Route Handler and job execution context; client validation is not sufficient.","The stream protocol should define safe event schemas and terminal-state rules so clients can distinguish `done`, `error`, and unexpected disconnects."]}