{"summary":"Create a dedicated `board` capability. It owns the cross-capability policy and projection; the RSC route only authenticates, invokes it, maps expected outcomes, and renders. `work-items` and `labels` remain independent and expose narrow trusted server APIs. Dependency direction is `app → board → board-owned ports → capability public surfaces`; neither source capability imports the board or the other source capability.","tree":[{"path":"src/app/board/page.tsx","purpose":"RSC composition boundary: obtain request identity, call `loadBoard`, map expected outcomes to `forbidden()`/`notFound()` or an error state, and render route-private presentation."},{"path":"src/app/board/_components/BoardView.tsx","purpose":"Route-private server-rendered board markup; receives an already authorized `BoardViewModel` and contains no loading, auth, or orchestration policy."},{"path":"src/modules/board/domain/board.ts","purpose":"Pure board types and status-grouping rules, including deterministic group and item ordering if required by the product."},{"path":"src/modules/board/application/load-board.ts","purpose":"Owns meaningful policy: remove archived items, collect referenced label IDs, require visible label details, attach labels, group items by status, and return the board projection or typed expected failure."},{"path":"src/modules/board/application/ports.ts","purpose":"Board-owned capability-shaped ports such as `WorkItemReader.listForBoard(actor)` and `LabelReader.getVisibleByIds(actor, ids)`."},{"path":"src/modules/board/server/work-items-adapter.ts","purpose":"Implements the board work-item port using only `@/modules/work-items/server`; validates/maps that public contract into board application values."},{"path":"src/modules/board/server/labels-adapter.ts","purpose":"Implements the board label port using only `@/modules/labels/server`; converts inaccessible/missing requested labels into the board operation’s typed rejection."},{"path":"src/modules/board/server/load-board.ts","purpose":"Server-only composition root that wires adapters, reporter, and request context into the application operation. It catches and reports unexpected failures once."},{"path":"src/modules/board/rsc.ts","purpose":"Narrow current-request RSC surface exporting `loadBoard`; marked `server-only`. This is the only board runtime surface needed for the stated task."},{"path":"src/modules/work-items/server.ts","purpose":"Existing narrow trusted API consumed by the board adapter; returns actor-scoped work-item summaries including archive state, status, and label IDs."},{"path":"src/modules/labels/server.ts","purpose":"Existing narrow trusted API consumed by the board adapter; accepts actor identity and requested IDs, returning visible label summaries plus a typed denial when any requested label is not viewable."},{"path":"src/modules/board/application/load-board.test.ts","purpose":"Unit tests for archive filtering, label-ID deduplication, inaccessible-label rejection, label attachment, grouping, ordering, and expected failure outcomes using port fakes."},{"path":"src/modules/board/server/load-board.test.ts","purpose":"Integration tests for adapter wiring, public-surface mapping, unexpected-failure redaction, and exactly-once reporting."},{"path":"src/app/board/page.test.tsx","purpose":"RSC tests for authenticated success rendering and channel-native mapping of unauthenticated, forbidden, and unexpected outcomes."},{"path":"src/modules/board/architecture.test.ts","purpose":"Import-boundary tests ensuring the board uses only source capabilities’ public surfaces and that work-items and labels never import each other."}],"flows":["Successful RSC read: `src/app/board/page.tsx` authenticates the request and builds identity `{ actor, roles, tenantScope, requestId, traceId }` → `board/rsc.ts` → board server composition root → `loadBoard` → `WorkItemReader.listForBoard` → work-items trusted API/store. The operation removes archived items and deduplicates their label IDs. Because the label query depends on those IDs, it then calls `LabelReader.getVisibleByIds` → labels trusted API/store. It verifies every referenced label is visible, attaches safe label summaries, groups items by status, and returns `BoardViewModel` to `BoardView`.","Authorization: missing identity is rejected before orchestration. Board-specific authorization consequences are enforced by `loadBoard`. Work-items and labels trusted APIs enforce their own business rules, while their stores/RLS apply tenant and ownership predicates. The board never trusts client-supplied actor or tenant values.","Inaccessible label: the labels API returns a non-enumerating typed denial if any requested ID is outside the actor’s visibility. The adapter maps it to `BoardLabelAccessDenied`; `loadBoard` returns a typed board failure and no partial board. The RSC boundary maps that outcome to the application’s forbidden behavior without exposing which label failed.","Expected source outcome: typed absence or denial is mapped once into a board outcome and is not reported as an exception. Unexpected database/provider defects propagate to the board server composition root, which reports once with request/trace context and redacted metadata, then rethrows; adapters and source operations do not report the same failure.","Empty board: after archive filtering, skip the labels call and return all defined status groups with empty item lists, or only populated groups if that is the established UI contract."],"decisions":[{"topic":"Orchestration owner","choice":"A dedicated `src/modules/board` capability","rationale":"Deleting it would move filtering, cross-capability authorization consequences, label attachment, and grouping into the route. Those are meaningful board policies, not framework composition."},{"topic":"Source capability independence","choice":"Board-owned ports with private adapters calling `work-items/server.ts` and `labels/server.ts`","rationale":"Work-items and labels do not know about each other or the board, and their internal persistence can change without affecting the board application operation."},{"topic":"Call ordering","choice":"Load work items first, then labels","rationale":"The label request is constrained to IDs referenced by visible, non-archived work items, so the calls cannot truthfully run in parallel."},{"topic":"Public surfaces","choice":"Expose only `board/rsc.ts`; consume existing narrow `work-items/server.ts` and `labels/server.ts`","rationale":"The task has only an RSC read channel. No Server Action, Route Handler, client API, or generic repository surface is justified."},{"topic":"Projection ownership","choice":"Return board-owned DTOs rather than provider rows or source domain entities","rationale":"The board controls its rendering contract and avoids leaking persistence shapes or coupling source capabilities’ models."},{"topic":"Failure policy","choice":"All-or-nothing label visibility and report unexpected failure once","rationale":"Rendering partial label information would violate the requested rejection rule; centralized reporting prevents duplicate incidents."},{"topic":"Runtime isolation","choice":"Mark all trusted surfaces `server-only` and enforce import boundaries in lint/build tests","rationale":"A production build must fail if browser code imports board or source server APIs."}],"risks":["The labels trusted API must distinguish inaccessible requested IDs without leaking their existence; if its current contract silently omits them, extend that public surface while preserving non-enumerating semantics.","Archive filtering after a broad work-item read is correct for board policy but may be inefficient. The trusted API may accept a board-shaped query hint, while the board operation must still own and test the hide-archived rule.","Status ordering and treatment of unknown statuses need an explicit product invariant; otherwise grouping can become nondeterministic when work-item statuses evolve.","If source APIs return partial pages, the board must define pagination before claiming a complete grouping; the stated task does not justify inventing that behavior."]}