{"summary":"Add one labels capability with direct RSC reads, Server Action mutations, and a dedicated cacheable browser GET. Keep CRUD orchestration minimal and enforce security at request, policy, and RLS boundaries.","tree":[{"path":"app/labels/page.tsx","purpose":"Authenticated RSC page; loads initial labels, renders create/rename forms, and mounts the client list."},{"path":"app/labels/LabelsClient.tsx","purpose":"Client Component that filters locally and refreshes through the browser GET without navigation."},{"path":"app/api/labels/route.ts","purpose":"Cacheable HTTP GET returning the public labels response shape."},{"path":"src/modules/labels/actions.ts","purpose":"Top-level Server Actions for create and rename form submissions."},{"path":"src/modules/labels/server.ts","purpose":"Server-only trusted labels API shared by the page, Route Handler, and actions."},{"path":"src/modules/labels/client.ts","purpose":"Browser-safe GET client and product-facing label types."},{"path":"src/modules/labels/server/store.ts","purpose":"Private Supabase/Postgres adapter; applies ownership predicates, validates rows, and maps snake_case rows to camelCase values."},{"path":"src/modules/labels/server/validation.ts","purpose":"Validates untrusted create and rename inputs and serialized public output."}],"flows":["RSC: app/labels/page.tsx → authenticate actor → labels/server.ts → store.ts → Supabase/Postgres/RLS → map rows → render initial labels and forms.","Browser refresh: LabelsClient.tsx → GET /api/labels → authenticate actor → scoped cached read → JSON response with private cache headers → update client state; filtering remains local.","Create/rename: form → actions.ts Server Action → authenticate actor → validate input → server.ts/store.ts → Supabase mutation → invalidate the labels cache tag → return typed success or field error; the page may refresh its RSC data.","Authorization: existing middleware establishes the authenticated request; server boundaries re-check identity, business policy remains capability-owned, and Supabase RLS enforces tenant/ownership predicates at the store boundary.","Failures: validation and expected uniqueness/conflict errors become stable action or HTTP responses; Route Handler owns status and headers, Server Actions own form-shaped errors, and unexpected provider/outage defects are reported once and remain exceptions. "],"decisions":[{"topic":"HTTP surface","choice":"Use app/api/labels/route.ts for GET only.","rationale":"A Server Action cannot provide the required cacheable browser HTTP GET contract."},{"topic":"Mutations","choice":"Use Server Actions for create and rename.","rationale":"Forms need mutations, and no separate mutation endpoint is required."},{"topic":"Application layer","choice":"Omit a separate application operation and repository port.","rationale":"This is simple store-backed CRUD with no meaningful policy orchestration or provider-independent core behavior."},{"topic":"Caching","choice":"Use a scoped labels cache keyed by actor/ownership scope and invalidate it after successful mutations.","rationale":"RSC and HTTP reads remain efficient without allowing one user or tenant’s labels to leak to another."},{"topic":"Data model","choice":"Keep provider rows private and expose only camelCase product values.","rationale":"The store adapter is the single snake_case-to-camelCase mapping boundary."}],"risks":["Do not use one globally shared cache entry for authenticated labels; scope cache keys and HTTP caching to the actor/tenant boundary.","Browser HTTP caches cannot be synchronously purged by a mutation, so refresh behavior must explicitly revalidate when immediate freshness is required.","Confirm the installed Next.js 16 cache API signature before implementation."]}