{"summary":"Propose one `labels` capability with direct server-backed CRUD, an authenticated RSC read, a cacheable private browser GET, and Server Action mutations. No application layer or repository port is warranted for this simple CRUD capability.","tree":[{"path":"app/(authenticated)/labels/page.tsx","purpose":"Authenticated RSC page composing initial labels data and UI."},{"path":"app/api/labels/route.ts","purpose":"Authenticated GET endpoint for browser refresh/filter; owns HTTP status, headers, query parsing, and JSON output."},{"path":"src/modules/labels/rsc.ts","purpose":"Server-only RSC read surface."},{"path":"src/modules/labels/actions.ts","purpose":"Top-level Server Actions for create and rename."},{"path":"src/modules/labels/client.ts","purpose":"Browser-safe GET contract and fetch helpers."},{"path":"src/modules/labels/ui/labels-panel.tsx","purpose":"Client Component for refresh, local filtering, loading, and errors."},{"path":"src/modules/labels/ui/label-forms.tsx","purpose":"Create and rename forms invoking Server Actions."},{"path":"src/modules/labels/server/auth.ts","purpose":"Actor authentication and request identity."},{"path":"src/modules/labels/server/store.ts","purpose":"Private Supabase/Postgres adapter with ownership/RLS predicates."},{"path":"src/modules/labels/server/mapping.ts","purpose":"Maps private snake_case rows to camelCase product values."},{"path":"src/modules/labels/server/validation.ts","purpose":"Validates IDs, names, query parameters, provider data, and serialized output."}],"flows":["Initial read: `page.tsx` -> `rsc.ts` -> `auth.ts` -> `store.ts` -> `mapping.ts` -> page and `LabelsPanel` initial props.","Refresh/filter: `LabelsPanel` -> `client.ts` -> `GET /api/labels?query=...` -> authenticate -> validate -> store -> map -> JSON. Filtering updates local state; refresh performs GET without navigation.","Create/rename: form -> `actions.ts` -> authenticate -> validate -> store mutation -> map conflict/not-found/provider failures -> revalidate labels cache -> typed serializable action result.","Caching: GET responses use an explicit private, identity-safe browser cache policy. Mutations invalidate the labels tag/path; successful actions refresh visible client data."],"decisions":[{"topic":"Ownership","choice":"Keep all product behavior under `src/modules/labels`; keep route composition under `app/**`.","rationale":"Labels is a single capability with clear ownership."},{"topic":"Application layer","choice":"Do not add `application/` or a repository port.","rationale":"Simple CRUD has no meaningful policy, branching, coordination, or provider-independent core operation."},{"topic":"Authentication","choice":"Authenticate independently at the RSC, Route Handler, and Server Action boundaries; enforce business authorization in capability code and tenant/ownership scope in store predicates and RLS.","rationale":"Every entry point remains safe, with the database as the final scope boundary."},{"topic":"Mapping","choice":"Keep storage rows private and map once in `server/mapping.ts`.","rationale":"Snake_case provider data must not leak into camelCase product contracts."},{"topic":"Failures","choice":"Route Handler owns HTTP errors; Server Actions return serializable form outcomes; RSC renders expected read failures; unexpected defects/outages remain exceptions and are reported once.","rationale":"Each runtime channel preserves its native failure semantics."}],"risks":["Authenticated responses must never use a shared cache without complete identity scoping.","Uniqueness, not-found, and provider errors require stable redacted failure codes.","If future labels behavior gains cross-capability coordination or substantial policy, introduce an application operation and capability-owned port then."]}