{"summary":"Create a small `board` orchestration capability. The board owns cross-capability policy and projection; `work-items` and `labels` remain independent and expose narrow trusted server APIs. This is required because deleting the orchestration would move filtering, grouping, label authorization, and projection into the RSC route.","tree":[{"path":"app/boards/[boardId]/page.tsx","purpose":"RSC composition boundary; authenticates the request, invokes `board/rsc.ts`, and renders the returned board view model."},{"path":"app/boards/[boardId]/error.tsx","purpose":"Route-level rendering for unexpected board failures; reports once at the route/error boundary."},{"path":"src/modules/board/application/load-board.ts","purpose":"Framework-neutral orchestration: loads work items, hides archived items, groups by status, resolves label details, rejects inaccessible labels, and creates the board projection."},{"path":"src/modules/board/application/ports.ts","purpose":"Small capability-shaped dependencies required by board orchestration, expressed in board/application terms."},{"path":"src/modules/board/rsc.ts","purpose":"Server-only current-request API; obtains authenticated request identity and invokes `load-board`."},{"path":"src/modules/board/server.ts","purpose":"Trusted server composition surface used by the RSC API to wire board dependencies without exposing stores."},{"path":"src/modules/work-items/server.ts","purpose":"Trusted work-items read API, including actor/tenant-scoped item retrieval; no label dependency."},{"path":"src/modules/labels/server.ts","purpose":"Trusted labels read API accepting actor identity and label IDs, returning visible details plus inaccessible IDs or a typed authorization outcome; no work-item dependency."}],"flows":["`app/boards/[boardId]/page.tsx` → authenticate actor/request scope → `src/modules/board/rsc.ts` → `src/modules/board/server.ts` → `application/load-board.ts`.","`load-board.ts` → `work-items/server.ts`: fetch actor/tenant-authorized work items. Board filters archived items and groups the remainder by status.","`load-board.ts` → `labels/server.ts`: pass distinct label IDs from the remaining items plus actor identity. If any attached label is not viewable, return an expected authorization outcome and render the board as forbidden; do not silently produce a partial board.","On success, `load-board.ts` attaches visible label details and returns a board-specific view model. The RSC page renders it directly.","Unexpected provider or defect failures propagate to `app/boards/[boardId]/error.tsx`; the outer boundary reports once. Expected authorization and validation outcomes remain typed and are not double-reported."],"decisions":[{"topic":"Orchestration ownership","choice":"Add `src/modules/board`","rationale":"Board-specific filtering, grouping, cross-capability authorization consequences, and projection are meaningful application policy and should not live in the route or work-items capability."},{"topic":"Dependency direction","choice":"Board depends on `work-items/server.ts` and `labels/server.ts`; those modules never depend on each other","rationale":"This preserves independent changeability and keeps the module graph acyclic."},{"topic":"Call ordering","choice":"Load work items first, then resolve labels","rationale":"The second query requires the label IDs present on non-archived board items."},{"topic":"Authorization","choice":"Authenticate at the RSC/server boundary; enforce board policy in `load-board`; enforce tenant/ownership predicates in each store","rationale":"Each layer protects a distinct trust boundary, and labels remain authoritative for label visibility."},{"topic":"Public surfaces","choice":"Expose only `rsc.ts`, `server.ts`, and the existing capability `server.ts` surfaces","rationale":"The board has an actual RSC consumer and trusted server composition need; no browser, action, HTTP, stream, or job surface is required."},{"topic":"Partial results","choice":"Reject the board when any referenced label is inaccessible","rationale":"The task requires rejecting labels the actor cannot view; silently omitting them would weaken that policy."}],"risks":["Label resolution must distinguish an empty result from inaccessible IDs so unauthorized labels cannot be mistaken for deleted or unassigned labels.","The board projection should use domain/public values, never provider rows; adapters map persistence records before returning them.","Add outcome-focused tests for archived filtering, status grouping, label attachment, inaccessible-label rejection, tenant/ownership enforcement, and report-once unexpected failures."]}