{"summary":"Name the feature “Canvas Templates” and make the existing `canvases` capability its owner. “Workspace” remains reserved for the tenant organization identified by `workspace_id`; the editor term is replaced in product/API vocabulary by “canvas template.” Templates save a canvas layout and apply it to a destination canvas. Authorization is evaluated against the destination canvas’s project membership; organizations, billing, subscriptions, and tenant lifecycle are out of scope.","tree":[{"path":"src/modules/canvases/application/templates.ts","purpose":"Owns save/apply policy, layout projection, sequencing, and destination-project membership consequences."},{"path":"src/modules/canvases/server/templates-store.ts","purpose":"Private persistence for template records and canvas-layout reads/writes; enforces canvas/project ownership predicates at the store boundary."},{"path":"src/modules/canvases/server.ts","purpose":"Explicit trusted server surface for template reads and the application operation; accepts established actor identity and scope."},{"path":"src/modules/canvases/rsc.ts","purpose":"Server Component read surface for listing templates available to the current destination canvas."},{"path":"src/modules/canvases/actions.ts","purpose":"Top-level `use server` UI mutation entrypoints for saving and applying templates."},{"path":"src/modules/canvases/ui.ts","purpose":"Reusable editor UI for naming, listing, previewing, and applying Canvas Templates."},{"path":"app/(editor)/canvases/[canvasId]/page.tsx","purpose":"Route composition only: renders the editor and consumes `canvases/rsc.ts` and `canvases/ui.ts`."}],"flows":["Read: `app/(editor)/canvases/[canvasId]/page.tsx` calls `src/modules/canvases/rsc.ts` → `canvases/server.ts` → private template store. The server derives the actor, verifies destination-canvas/project membership, and returns stable template DTOs.","Save: editor UI → `canvases/actions.ts` → authenticate and validate actor, source canvas ID, name, and layout bounds → `canvases/application/templates.ts` → read the source canvas layout and persist a Canvas Template through `server/templates-store.ts` → invalidate the editor’s template view.","Apply: editor UI → `canvases/actions.ts` → authenticate and validate destination canvas ID/template ID → `canvases/application/templates.ts` → verify membership on the destination canvas’s project, load the template, project its layout onto the destination canvas, and persist atomically → return typed action state and invalidate the destination canvas/editor view.","Cross-capability access: the canvases capability may consume narrow `projects/server.ts` and existing canvas server contracts through private adapters, but organizations and billing are not called. No source capability imports `canvases` internals or action/channel wrappers."],"decisions":[{"topic":"Product name","choice":"Canvas Templates","rationale":"It describes a reusable saved canvas layout without colliding with the established tenant meaning of workspace."},{"topic":"Capability owner","choice":"Canvases","rationale":"The lifecycle and mutation target are canvas layouts; authorization follows the destination canvas’s project membership. The feature does not create or manage organizations, subscriptions, or tenants."},{"topic":"Overloaded term","choice":"Use “workspace” only for organizations; use “canvas template” in UI, routes, contracts, and persistence terminology.","rationale":"Separating vocabulary prevents tenant authorization and editor-layout concepts from being accidentally joined."},{"topic":"Application boundary","choice":"Keep one application operation for save/apply policy and coordination.","rationale":"Applying a template coordinates template lookup, destination authorization, layout projection, and an atomic canvas update; deleting it would leak meaningful sequencing and authorization consequences into actions or routes."},{"topic":"Runtime channels","choice":"Use `rsc.ts` for reads and `actions.ts` for editor mutations; do not add a Route Handler.","rationale":"These are authenticated first-party App Router interactions. Current Next.js guidance recommends direct server-side reads from Server Components and Server Actions for mutations, while Route Handlers are for HTTP-facing contracts. [Next.js data fetching](https://nextjs.org/docs/app/getting-started/fetching-data) [Next.js mutating data](https://nextjs.org/docs/app/getting-started/mutating-data)"},{"topic":"Trust boundary","choice":"Authenticate at each RSC/action entrypoint, authorize in the canvases application policy, and enforce canvas/project predicates in the private store.","rationale":"Client fields and hidden form values are untrusted; defense in depth prevents applying a template to a destination the actor cannot edit."}],"risks":["A template may contain layout references unavailable on the destination canvas; the application operation must define whether to reject, omit, or normalize those references.","Concurrent edits can overwrite destination-canvas changes; use an atomic update with the existing canvas version/concurrency mechanism if one exists.","Existing editor terminology may still expose “workspace”; renaming labels and contracts must be complete enough that tenant `workspace_id` cannot be confused with a canvas template."]}