{"summary":"Add a board-owned read slice. The board RSC authenticates through a server-only DAL, invokes a board use case with injected work-item and label read ports, applies all board policy, and renders a serializable view model. Work-items and labels retain independent persistence and public server APIs and never import one another.","tree":[{"path":"app/board/page.tsx","purpose":"Thin RSC entrypoint; calls the board server-only read entrypoint and renders the board view."},{"path":"src/board/domain/board.ts","purpose":"Board DTOs, Valibot schemas, status-group and visible-label types."},{"path":"src/board/application/get-board.ts","purpose":"Board orchestration: fetches both capabilities, hides archived items, groups by status, validates visible labels, and builds the board view model."},{"path":"src/board/application/ports.ts","purpose":"Board-owned ports for trusted work-item and label reads; contains no persistence or framework imports."},{"path":"src/board/adapters/inbound/dal/get-board.ts","purpose":"Server-only DAL entrypoint; resolves the actor, enforces board access, composes outbound adapters, and invokes the use case."},{"path":"src/board/ui/board-view.tsx","purpose":"RSC-compatible presentation of grouped board data."},{"path":"src/work-items/application/ports/read-work-items.ts","purpose":"Stable trusted server read surface owned by work-items."},{"path":"src/work-items/adapters/outbound/supabase/read-work-items.ts","purpose":"Work-item persistence adapter; owns queries, row mapping, RLS assumptions, and work-item cache tags."},{"path":"src/labels/application/ports/read-labels.ts","purpose":"Stable trusted server read surface owned by labels, including actor-visible label lookup."},{"path":"src/labels/adapters/outbound/supabase/read-labels.ts","purpose":"Label persistence adapter; owns label queries, visibility filtering, row mapping, and label cache tags."},{"path":"src/infrastructure/auth/verify-actor.ts","purpose":"Server-side actor/session verification used at the DAL boundary."},{"path":"src/infrastructure/observability/report-error.ts","purpose":"Redacted reporting for caught unexpected failures; domain and use cases remain telemetry-free."},{"path":"tests/board/application/get-board.test.ts","purpose":"Use-case tests with fake work-item and label ports."},{"path":"tests/board/adapters/inbound/get-board.test.ts","purpose":"DAL/auth and error-mapping tests."},{"path":"tests/board/ui/board-view.test.tsx","purpose":"Rendering tests for groups, hidden archived items, and missing/rejected labels."},{"path":"tests/e2e/board.spec.ts","purpose":"Authenticated end-to-end board read and authorization coverage."}],"flows":["RSC read: `app/board/page.tsx` -> `src/board/adapters/inbound/dal/get-board.ts` -> `verify-actor.ts` -> `src/board/application/get-board.ts` -> injected work-item read port + injected label-visible read port -> board policy -> serializable board DTO -> `src/board/ui/board-view.tsx`.","Work-item branch: board use case -> work-item trusted read surface -> work-item Supabase adapter. Labels branch: board use case -> label trusted read surface -> label Supabase adapter. Neither capability imports the other.","Authorization: proxy may refresh or redirect, but the board DAL rechecks the actor. Each capability adapter also scopes reads through its own RLS/ownership and visibility rules; the board use case rejects label references not returned as visible.","Failure handling: expected unauthenticated/unauthorized outcomes become redirect or safe access-denied results at the DAL/page boundary. Unexpected caught failures are reported once with redacted context and converted to a generic server error; raw database/provider messages never reach the UI.","Cache: the board read is RSC/DAL-owned. If cached, its tags are scoped to the actor or tenant and composed from board-relevant work-item and label ownership; mutations in either capability invalidate their own tags and the board tag through an explicit dependency/invalidation contract."],"decisions":[{"topic":"Orchestration ownership","choice":"`src/board/application/get-board.ts` owns cross-capability policy","rationale":"Archive hiding, status grouping, label attachment, and rejecting invisible labels are board behavior, not work-item or label persistence behavior."},{"topic":"Dependency direction","choice":"Board use case depends only on local ports; DAL/inbound composition injects concrete adapters","rationale":"This preserves independent changeability and prevents use cases from importing Supabase, Next.js, React, or sibling adapters."},{"topic":"Public surfaces","choice":"Expose narrow server-only trusted read ports from work-items and labels","rationale":"The board needs stable capability contracts without coupling to tables, raw rows, or internal repositories."},{"topic":"Read ownership","choice":"RSC plus server-only DAL","rationale":"The task describes an initial board page read, not polling, infinite scroll, optimistic updates, or a browser-owned cache."},{"topic":"Authorization","choice":"Recheck auth at DAL and capability data boundaries","rationale":"Route protection alone is insufficient; label visibility must be derived server-side and never trusted from client-provided label IDs."},{"topic":"Failure policy","choice":"Fail closed for authorization and invisible labels; report unexpected failures once","rationale":"Security-sensitive data must not leak, while operational failures need observability without exposing provider details."}],"risks":["If work-item and label APIs return unbounded data, board latency and memory use can grow; define bounded reads or pagination before large boards are supported.","Cross-capability cache invalidation must be an explicit contract; otherwise board pages can remain stale after independent capability mutations.","A decision is required for mixed upstream failures: recommended behavior is fail the board read with a generic error rather than render incomplete data that could misrepresent authorization or workflow state."]}