{"summary":"Place the capability under `src/modules/assistant-stream/`. Keep generation policy framework-neutral, with separate HTTP stream and background-job lifecycle adapters. The Route Handler owns HTTP concerns; the stream adapter owns cancellation, commit state, idle timeout, and in-band failures.","tree":[{"path":"app/api/assistant/stream/route.ts","purpose":"Authenticated HTTP entry point. Validates the browser request, creates request/trace identity, invokes the capability stream surface, and returns the SSE response or pre-commit error."},{"path":"src/modules/assistant-stream/application/generate.ts","purpose":"Framework-neutral generation policy: prompt/model policy, provider-result validation, safe expected-failure classification, and orchestration through explicit ports."},{"path":"src/modules/assistant-stream/application/ports.ts","purpose":"Capability-shaped ports for the remote model, clock/deadline handling, persistence/job effects where required, and report-once failure reporting."},{"path":"src/modules/assistant-stream/domain/generation.ts","purpose":"Pure generation inputs, token/chunk invariants, safe failure codes, and retryability classification."},{"path":"src/modules/assistant-stream/server/provider/remote-model.ts","purpose":"Private adapter for the remote model provider. Translates provider rows/errors into trusted capability values and preserves the supplied `AbortSignal`."},{"path":"src/modules/assistant-stream/server/reporting.ts","purpose":"Private reporter adapter with request-scoped/idempotent report-once behavior and redaction."},{"path":"src/modules/assistant-stream/stream.ts","purpose":"Streaming public contract. Converts application chunks to SSE, tracks header commitment, applies per-read idle timeout, propagates cancellation, and emits one in-band failure event after commitment."},{"path":"src/modules/assistant-stream/job.ts","purpose":"Worker-facing public contract. Runs the same application generation policy with job-specific deadline, persistence, retry, and dead-letter decisions."},{"path":"src/modules/assistant-stream/client.ts","purpose":"Browser-safe stream client using `fetch` and an `AbortController`; parses SSE token, completion, and failure events."}],"flows":["Browser → `app/api/assistant/stream/route.ts`: authenticate, validate prompt, create request/trace identity, and invoke `src/modules/assistant-stream/stream.ts`.","Route Handler → `stream.ts` → `application/generate.ts` → `server/provider/remote-model.ts`: the provider receives the request abort signal. Browser disconnect or explicit cancel aborts the HTTP request, which aborts the provider request and closes the stream.","`stream.ts` starts a fresh idle timer whenever provider data arrives. The timer fails only after no data has arrived for the configured idle interval; it does not impose a maximum duration on an otherwise active stream.","Before SSE headers commit, expected failures become a safe HTTP status/body. After commitment, `stream.ts` reports unexpected failures once, sends one safe SSE failure event, and closes the stream. Expected provider failures are mapped to safe failure codes without leaking provider details.","Background worker → `job.ts` → `application/generate.ts` → provider adapter and job-owned sink. The worker applies a total job deadline, persists successful output, retries only classified transient failures within the retry budget, and dead-letters permanent/exhausted failures. Job retries do not reuse HTTP idle-timeout or SSE behavior."],"decisions":[{"topic":"Application boundary","choice":"Use `application/generate.ts` as the shared policy boundary","rationale":"The browser stream and worker share meaningful prompt/provider/error policy, while HTTP streaming and job retry semantics remain channel-specific."},{"topic":"Provider seam","choice":"Define a remote-model port in `application/ports.ts` and implement it privately in `server/provider/remote-model.ts`","rationale":"Application code stays independent of provider SDK types and can validate/map provider failures at the adapter boundary."},{"topic":"Cancellation and timeout","choice":"Carry `AbortSignal` end-to-end and enforce idle timeout in `stream.ts`","rationale":"Cancellation belongs to the request/stream lifecycle; idle timeout must reset per provider activity and must not cap total successful duration."},{"topic":"Failure reporting","choice":"Use a request/job-scoped report-once reporter","rationale":"Unexpected exceptions can surface through multiple cleanup paths, so reporting must be idempotent while public failure output remains safe."},{"topic":"Authorization","choice":"Authenticate in the Route Handler/worker boundary, enforce generation policy in the application layer, and apply tenant/ownership predicates in any persistence adapter","rationale":"Each runtime boundary and data boundary owns the authorization concern appropriate to it."}],"risks":["Provider SDK behavior must be verified so aborts do not get misclassified as reportable failures.","SSE clients must treat the in-band failure event as terminal and avoid retrying an already-cancelled request.","Report-once identity must remain stable across stream cleanup and worker retry attempts while allowing separate retry attempts to be observable.","If generated output is persisted, the store adapter must prevent cross-tenant or cross-user writes independently of application checks."]}