{"summary":"Use one capability root with three module files plus three route files. Keep create/rename as Server Actions, but add one GET Route Handler because browser-owned refresh/filter reads must use HTTP GET; Server Actions are mutation boundaries, not cacheable read endpoints.","tree":[{"path":"src/app/(authenticated)/labels/page.tsx","purpose":"Authenticated RSC page. Resolves the session, performs the initial label read through `labels/server.ts`, and renders the route-private client component and forms."},{"path":"src/app/(authenticated)/labels/labels-client.tsx","purpose":"Small Client Component owning filter text, refresh state, GET requests, and action-result handling. Initial labels arrive as props."},{"path":"src/app/api/labels/route.ts","purpose":"Authenticated GET boundary for browser reads. Parses filter query parameters, calls the server surface, and owns HTTP status, JSON shape, ETag, and private cache headers."},{"path":"src/modules/labels/server.ts","purpose":"`server-only` capability service. Creates/receives the existing request-scoped Supabase client, performs list/create/rename queries, validates returned rows, maps snake_case rows to camelCase product values, and maps expected database failures."},{"path":"src/modules/labels/actions.ts","purpose":"Top-level `'use server'` exports for `createLabel` and `renameLabel`. Authenticates every invocation, validates `FormData`, calls `server.ts`, returns serializable form outcomes, and triggers Next.js cache/page refresh behavior."},{"path":"src/modules/labels/client.ts","purpose":"Browser-safe `Label`, GET response, filter, and action-state contracts plus the small `fetchLabels` helper. Contains no server imports or Supabase types."}],"flows":["Initial RSC: `labels/page.tsx` → existing session verifier → `labels/server.ts:listLabels(identity, filter?)` → request-scoped Supabase client → Postgres/RLS → validate database row → map `{created_at, owner_id}` to `{createdAt, ownerId}` → render `labels-client.tsx` with camelCase labels. Redirect unauthenticated page requests to the existing login flow.","Browser refresh/filter: `labels-client.tsx` → `GET /api/labels?filter=…` → Route Handler authenticates independently → validates/normalizes the query → `server.ts:listLabels` → Supabase/RLS → mapped labels → validate the public response contract → JSON response. Debounce filtering and cancel superseded requests with `AbortController`; refresh replaces client state without navigation.","Create: form → `createLabel(FormData)` → authenticate action → validate/normalize name → `server.ts:createLabel` → Supabase insert scoped by the authenticated actor/RLS → map the returned row → invalidate the labels tag and refresh the current router view → serializable success or field/form error. The client then issues a conditional GET with `cache: 'no-cache'` so its independently cached HTTP list observes the write.","Rename: form includes an opaque label ID and name → `renameLabel(FormData)` → authenticate → validate both values → `server.ts:renameLabel` using `WHERE id = …` plus tenant/owner scope → RLS → map returned row → invalidate/refresh → client re-fetches the GET collection. Never trust a hidden owner or tenant field."],"decisions":[{"topic":"Capability shape","choice":"No `domain/`, `application/`, repository port, or provider interface","rationale":"This is simple CRUD with no stated business policy, alternate provider, or orchestration. Deleting an application layer would only move forwarding calls, so the channel boundaries call a private store-backed server service directly."},{"topic":"Authentication and authorization","choice":"Authenticate in the RSC page, GET handler, and each Server Action; retain explicit owner/tenant predicates and existing RLS","rationale":"Middleware is useful for early routing but cannot secure independently callable Route Handlers or Server Actions. RLS remains the final store authorization boundary. No additional business-role layer is needed unless product rules exist."},{"topic":"Validation","choice":"Validate query/FormData at channel entry, validate Supabase rows on entry to trusted code, and validate the GET response contract","rationale":"Inputs, database contents, and HTTP serialization are distinct trust boundaries. Typed internal values are not parsed again merely because they cross files."},{"topic":"Mapping","choice":"Keep Supabase row types private to `server.ts`; expose only camelCase capability contracts","rationale":"Prevents snake_case persistence details and provider errors from leaking into RSC, actions, or browser code."},{"topic":"HTTP caching","choice":"Keep the authenticated GET dynamic and emit `Cache-Control: private, max-age=<short>, must-revalidate` with an ETag; honor `If-None-Match` with `304`","rationale":"A shared/static Route Handler cache could leak one user or tenant’s labels to another. Private HTTP caching satisfies cacheable browser GETs while authentication still runs at the endpoint."},{"topic":"Next.js invalidation","choice":"Tag server-side label reads by authorization scope and call `updateTag(scopeTag)` from successful Server Actions; also refresh/re-fetch the browser list","rationale":"Next.js 16 `updateTag` gives Server Actions read-your-own-writes semantics, but it does not invalidate a browser’s HTTP cache. The client’s conditional re-fetch handles that separate cache. If Cache Components are not enabled, use the project’s existing tagged-cache mechanism or `revalidatePath('/labels')` for the RSC side while retaining the GET re-fetch."},{"topic":"Failure ownership","choice":"Each runtime boundary translates failures into its native semantics","rationale":"The store maps expected not-found/uniqueness/provider outcomes once. The GET handler owns 400/401/404/409/500 and redacted JSON; actions own field/form state; the RSC page owns redirect/error-boundary behavior; the Client Component owns pending, cancellation, stale-display, and retry UI. Unexpected defects are reported once server-side and thrown, not exposed verbatim."}],"risks":["Caching authenticated data without an actor/tenant-scoped key or with public/shared response headers can leak labels across users.","Middleware-only authentication is insufficient because Route Handlers and Server Actions are direct entry points.","`updateTag` only covers Next.js server caches; omitting the client’s revalidation request can leave its private HTTP cache stale after a mutation.","Filter input must be bounded in length and translated to parameterized Supabase predicates; do not interpolate it into SQL-like expressions.","A rename that reports zero affected rows must remain indistinguishable between nonexistent and unauthorized records unless product requirements explicitly permit that disclosure."]}