{"summary":"Create a dedicated POST Route Handler for SSE and keep the reusable generation policy framework-neutral. Do not reuse a Server Action: Server Actions are mutation/RPC boundaries, while Route Handlers expose the Web Request/Response streaming primitives needed for headers, disconnect cancellation, and post-commit failures. Do not force HTTP, SSE, and jobs into one result wrapper; share failure taxonomy and generation policy, then let each channel translate outcomes into its native lifecycle. This matches current Next.js guidance for [Route Handler streaming](https://nextjs.org/docs/app/api-reference/file-conventions/route) and [Server Actions](https://nextjs.org/docs/app/getting-started/updating-data).","tree":[{"path":"src/app/api/assistant/stream/route.ts","purpose":"POST HTTP boundary: authenticate, validate input, create request/trace context, construct SSE Response, track commit state, connect cancellation, and translate failures before or after commit."},{"path":"src/modules/assistant/application/generate.ts","purpose":"Framework-neutral generation operation containing shared model-selection and generation policy. Accepts prompt, identity scope, AbortSignal, and capability-owned dependencies; returns a typed stream attempt."},{"path":"src/modules/assistant/application/generation-failure.ts","purpose":"Closed safe failure taxonomy such as invalid_request, denied, unavailable, idle_timeout, and cancelled, including retryability without provider messages or stack traces."},{"path":"src/modules/assistant/application/model-provider.ts","purpose":"Capability-shaped provider port: start generation and expose validated token events through an async iterable while honoring AbortSignal."},{"path":"src/modules/assistant/server/remote-model-provider.ts","purpose":"Private remote-provider adapter. Builds provider requests, validates provider events, maps known provider errors into GenerationFailure, and forwards cancellation to the provider SDK/fetch call."},{"path":"src/modules/assistant/server/create-generation.ts","purpose":"Server-only composition of generate.ts with provider/config dependencies; no HTTP or job policy."},{"path":"src/modules/assistant/server/report-once.ts","purpose":"Request/attempt-scoped reporting guard used by channel adapters so one unexpected exception produces at most one report."},{"path":"src/modules/assistant/stream.ts","purpose":"Public browser-safe SSE contract: event names and serialized safe payload schemas only; no provider or server imports."},{"path":"src/modules/assistant/client/consume-generation.ts","purpose":"Browser fetch/SSE parser. Sends prompt, exposes tokens, recognizes terminal done/failure events, and aborts fetch when the user cancels or the UI unmounts."},{"path":"src/modules/assistant/job.ts","purpose":"Trusted worker surface accepting a job payload and returning a job-native disposition: completed, retry with delay, or dead-letter."},{"path":"src/modules/assistant/server/run-generation-job.ts","purpose":"Consumes the same generate operation to completion, applies job deadline and attempt metadata, persists output through an explicit dependency, and maps failures to retry/dead-letter decisions."}],"flows":["Browser success: consume-generation.ts creates an AbortController → POST /api/assistant/stream → route authenticates and validates before constructing the stream → generate.ts calls ModelProvider → remote-model-provider.ts yields validated tokens → Route Handler encodes `event: token` records and finally one `event: done` record. Use `text/event-stream`, `Cache-Control: no-cache, no-transform`, and appropriate anti-buffering deployment configuration; Next.js notes that proxies must support streaming end to end in its [self-hosting guidance](https://nextjs.org/docs/app/guides/self-hosting).","Cancellation: browser abort or request disconnect triggers the Route Handler's linked AbortController → the same signal reaches generate.ts and remote-model-provider.ts → provider transport is aborted and the iterator is closed. Cancellation is expected control flow: close quietly, do not retry, report, or emit a failure event to a disconnected client.","Idle timeout: the Route Handler races each wait for the next provider event against an idle timer and resets that timer after every received event. Expiry aborts the linked controller with an idle-timeout reason. There is no whole-stream HTTP deadline, so an active successful stream can run indefinitely. The job adapter may impose its own overall attempt deadline because job lifecycle policy is different.","Failure before commit: authentication/validation failures return ordinary safe 4xx JSON; known generation/provider failures return their mapped safe status, commonly 429/502/503. An unexpected exception is passed through report-once.ts and returned as a generic 500 JSON response. Never expose provider bodies, stack traces, credentials, or internal classifications.","Failure after commit: once the Response stream has started, status and headers cannot change. The stream adapter reports an unexpected exception through report-once.ts, emits exactly one terminal `event: failure` with a safe code and request ID if the connection remains writable, and closes. Known mapped failures use the same terminal event without defect reporting. Never emit both failure and done.","Retry discipline: do not perform ordinary request-level retries after any token is observable; restarting would duplicate or contradict output. A provider adapter may retry connection establishment only before the first token and only when policy explicitly marks the failure retryable. The Route Handler itself performs no replay.","Background job: worker → job.ts → run-generation-job.ts creates an attempt AbortController and deadline → create-generation.ts → generate.ts → provider. It consumes the stream without SSE, persists only a complete successful result, and returns completed. A mapped transient failure or attempt deadline returns retry with bounded backoff while attempts remain; permanent input/auth/policy failures return dead-letter; exhausted transient failures return dead-letter. Cancellation caused by worker shutdown is re-queued according to queue ownership rules, not reported as a defect.","Unexpected job failure: report-once.ts records the exception once with job ID, attempt, trace ID, and safe provider phase; run-generation-job.ts then chooses retry or dead-letter from the job policy. Reporting is an outer-boundary effect and does not belong inside generate.ts."],"decisions":[{"topic":"Capability owner","choice":"`src/modules/assistant` owns generation behavior and contracts.","rationale":"All product behavior remains discoverable under one capability; `app/**` only adapts framework routing."},{"topic":"Application boundary","choice":"Use `application/generate.ts` as the shared policy operation, returning typed outcomes/events and exceptions rather than a universal channel result.","rationale":"Deleting it would duplicate model-selection and failure policy across HTTP and jobs, satisfying the deletion test."},{"topic":"Streaming boundary","choice":"Use `src/app/api/assistant/stream/route.ts`, not a Server Action.","rationale":"A Route Handler owns Response headers, ReadableStream state, request cancellation, and pre/post-commit behavior. Server Actions are designed for server-side mutations and serialize calls/results through framework-managed POST requests."},{"topic":"Provider seam","choice":"Define a capability-language ModelProvider port in application and keep the remote SDK/fetch adapter private under server.","rationale":"Generation policy must not depend on provider event shapes, exception types, or credentials."},{"topic":"Failure abstraction","choice":"Share safe failure codes, retryability, redaction, mapping, and report-once context; keep HTTP status, SSE terminal events, and job disposition separate.","rationale":"A generic wrapper would erase lifecycle facts that each channel must preserve."},{"topic":"Timeout ownership","choice":"HTTP owns an inactivity timer; jobs own an overall attempt deadline and retry budget.","rationale":"An idle timeout detects a stalled provider without limiting a healthy long stream, while workers require bounded attempts."},{"topic":"Runtime isolation","choice":"Mark server composition/adapters `server-only`; expose only stream.ts to browser code.","rationale":"This prevents provider credentials and server dependencies from entering the client bundle."}],"risks":["Some platforms or reverse proxies buffer SSE or impose hard execution limits; deployment must be verified with a stream longer than those defaults.","If the provider cannot accept AbortSignal or close its iterator, browser cancellation and idle timeout will not release upstream work promptly.","SSE framing must sanitize or JSON-encode payloads and the client must treat failure/done as mutually exclusive terminal events.","Job output persistence needs idempotency keyed by job/generation ID so a worker crash after persistence but before acknowledgement cannot duplicate effects.","Tests should cover disconnect propagation, timer reset on every chunk, no total HTTP deadline, pre-commit status mapping, exactly one post-commit failure event, and exactly one unexpected-error report."]}