{"summary":"Add labels as a vertical slice with pure domain schemas, injected query/command use cases, one Supabase repository, three authenticated inbound boundaries, and a small client-owned interactive list. The initial RSC read is server-owned; refresh/filter snapshots are browser-owned GETs; create/rename forms use Server Actions.","tree":[{"path":"src/domain/labels/label.ts","purpose":"Camel-case Label type and pure row-to-product invariants."},{"path":"src/domain/labels/schemas.ts","purpose":"Valibot schemas for label ID, create name, rename input, and list filter; trim strings and enforce explicit length limits."},{"path":"src/use-cases/labels/labels-repository.ts","purpose":"Port for list, create, and rename operations, including authenticated actor/tenant scope."},{"path":"src/use-cases/labels/list-labels.ts","purpose":"Query orchestration returning product-shaped labels."},{"path":"src/use-cases/labels/create-label.ts","purpose":"Create command and transport-neutral conflict/not-found outcomes."},{"path":"src/use-cases/labels/rename-label.ts","purpose":"Rename command and transport-neutral conflict/not-found outcomes."},{"path":"src/adapters/outbound/supabase/labels-repository.ts","purpose":"Supabase implementation with explicit columns, ownership predicates, snake_case mapping, and database-error translation."},{"path":"src/adapters/outbound/supabase/label-row.ts","purpose":"Private snake_case row schema and LabelRow-to-Label mapper."},{"path":"src/infrastructure/auth/verify-session.ts","purpose":"Server-only verified identity and authorization scope; never relies on proxy protection alone."},{"path":"src/infrastructure/supabase/server-client.ts","purpose":"Server-only request-scoped Supabase client factory."},{"path":"src/infrastructure/cache/label-tags.ts","purpose":"Build user/tenant-scoped cache tags such as labels:<scopeId>; never expose them to clients."},{"path":"src/dal/labels/read-labels.ts","purpose":"Server-only RSC read composition: verify auth, construct repository, execute list use case, and apply scoped server caching."},{"path":"src/adapters/inbound/next/labels/get-labels.ts","purpose":"GET handler implementation: authenticate, parse search params, execute list use case, and produce safe HTTP responses."},{"path":"src/adapters/inbound/next/labels/actions.ts","purpose":"Create and rename Server Actions: authenticate, parse FormData, execute commands, invalidate the scoped label tag, and return form-safe results."},{"path":"src/app/api/labels/route.ts","purpose":"Thin authenticated GET export for browser refresh/filter reads."},{"path":"src/app/(authenticated)/labels/page.tsx","purpose":"Authenticated RSC page that calls the DAL directly and passes the initial unfiltered snapshot to the client island."},{"path":"src/ui/labels/labels-panel.tsx","purpose":"Small Client Component holding filter/loading/error state and fetching GET /api/labels without navigation."},{"path":"src/ui/labels/create-label-form.tsx","purpose":"Form bound to the create Server Action with pending and field-error presentation."},{"path":"src/ui/labels/rename-label-form.tsx","purpose":"Form bound to the rename Server Action; label ID is treated only as input, never authority."},{"path":"src/domain/labels/*.test.ts","purpose":"Schema limits, normalization, and mapping-independent domain rules."},{"path":"src/use-cases/labels/*.test.ts","purpose":"Query and command behavior against fake repository ports."},{"path":"src/adapters/outbound/supabase/labels-repository.test.ts","purpose":"Explicit column selection, snake_case mapping, scoped writes, and database-error translation."},{"path":"src/adapters/inbound/next/labels/*.test.ts","purpose":"Authentication, parsing, safe error mapping, HTTP caching, and invalidation behavior."},{"path":"src/ui/labels/labels-panel.test.tsx","purpose":"Initial rendering, filtering, refresh, stale-response handling, and recoverable errors."}],"flows":["Initial page: browser → `src/app/(authenticated)/labels/page.tsx` → `src/dal/labels/read-labels.ts` → verified session/scope → `listLabels` use case → injected Supabase repository → explicit Postgres columns → row validation and snake_case-to-camelCase mapping → serializable labels → `LabelsPanel` initial props. No same-origin HTTP call is made by the RSC.","Interactive read: `LabelsPanel` normalizes the filter and aborts any superseded request → `GET /api/labels?filter=...` → thin route → inbound handler → verified session/scope → server-side Valibot parsing → list use case → repository → JSON DTO. The response uses `Cache-Control: private, max-age=30, must-revalidate` plus an ETag; private caching prevents cross-user sharing. Explicit Refresh sends a revalidating request (`cache: no-cache`) without navigation.","Create: create form → Server Action → verify session → parse unknown FormData with the create schema → create use case → repository insert with server-derived owner/tenant fields → validate/map returned row → invalidate `labels:<scopeId>` for read-your-own-writes → return a discriminated success or field/form error. The client refreshes its GET-owned snapshot after success.","Rename: rename form → Server Action → verify session → parse label ID/name → rename use case → repository update constrained by both label ID and server-derived owner/tenant scope → validate/map returned row → invalidate `labels:<scopeId>` → return safe action result → client refreshes its GET snapshot.","Authorization: every DAL, GET, and Server Action path verifies identity independently. RLS remains the database authority, while repository reads/writes also apply explicit user/tenant predicates. Hidden IDs, initial props, and client validation never establish ownership.","Failure ownership: domain schemas own validation messages; use cases own expected transport-neutral outcomes; the Supabase adapter maps Postgres/PostgREST codes and logs no public details; GET/actions translate expected outcomes to HTTP/action results. Unexpected caught failures are captured once at the inbound boundary with redacted scope metadata, then returned as generic errors. The client owns retry/inline presentation, not server diagnostics."],"decisions":[{"topic":"Read ownership","choice":"RSC/DAL owns the initial snapshot; the client island owns subsequent filtered/refreshed snapshots through GET.","rationale":"This satisfies authenticated first paint and navigation-free interaction while documenting the otherwise mixed ownership explicitly."},{"topic":"Client state library","choice":"Use a small component-local request state machine, not TanStack Query.","rationale":"One isolated list with manual refresh/filtering does not require shared cache lifecycle, polling, infinite scroll, or optimistic updates."},{"topic":"Mutation boundary","choice":"Server Actions for create and rename.","rationale":"They are same-application form commands; route handlers remain dedicated to cacheable browser reads."},{"topic":"Persistence","choice":"One Supabase repository behind a use-case-owned port.","rationale":"Supabase is the only planned provider, but isolating it preserves dependency direction and keeps database rows/errors out of product and UI layers."},{"topic":"Mapping","choice":"Validate snake_case rows inside the outbound adapter and return camelCase Label values.","rationale":"Database representation must not leak beyond the persistence boundary."},{"topic":"Caching","choice":"Scoped server tag for RSC data plus private HTTP caching/ETag for GET responses.","rationale":"Server Action invalidation provides fresh server renders, while authenticated browser responses remain cacheable without entering shared caches."},{"topic":"Filter semantics","choice":"Treat filtering as non-shareable component state unless product requirements later require shareable URLs.","rationale":"The task explicitly requests filtering without navigation; URL search parameters can replace this if shareability becomes required."}],"risks":["Server tag invalidation cannot evict an already stored browser response; the client must revalidate/refetch its GET snapshot after a successful mutation.","The exact Next.js 16 cache API syntax should be selected from the installed framework version during implementation; the architectural owner remains the DAL/action boundary.","Database uniqueness should be enforced with a scoped unique constraint if duplicate label names are forbidden; the repository should map its violation to `ConflictError`.","Rapid filter changes can render stale responses unless requests are aborted or response sequence IDs are checked.","If labels are tenant-scoped rather than user-scoped, every cache tag, RLS policy, repository predicate, and uniqueness constraint must consistently use the tenant identifier."]}